"currency","burnDate","inSymbol","inAmount","outSymbol","outAmount","xactnFee","inCoinPrice","outCoinPrice","xactnFeeCoinPrice","xactnType","xactnTypeDetail","xactnId","inAmountRaw","outAmountRaw","xactnFeeRaw","sender","recipient","memo","burnDateAltFormat1"
"USD","2025-11-06T18:03:31.000Z","STX","0.001","","0","0","N/A","","","Receive","'101870658'","0x905ae35d431de595bfc901e4dfa8df5bbd748aab8f4f35836600e79b82e8ad63","1000","0","0","SP2TBW1RSC44JZA4XQ1C2G5SZRGSMM14C5NWAKSDD","","101870658","11/06/2025 18:03:31"
"USD","2025-11-06T18:03:31.000Z","STX","0.001","","0","0","N/A","","","Receive","'101870658'","0xf69e410966dab1d8c0adabfdc82cfdcc745adf4f89e40da3fec86b1edd9e5f7d","1000","0","0","SP2TBW1RSC44JZA4XQ1C2G5SZRGSMM14C5NWAKSDD","","101870658","11/06/2025 18:03:31"
"USD","2025-11-06T18:03:31.000Z","","0","STX","610283.000","0.0004","","N/A","N/A","Send","'101870658'","0x33682659ff00738fec042277f677d7435974d74fff7e080016df0f3016a923ec","0","610283000000","400","","SP2TA4FGB43WVAS8MVS6YCWTSN2BZNQ1ASGEAKSDD","101870658","11/06/2025 18:03:31"
"USD","2025-11-06T17:54:54.000Z","STX","0.001","","0","0","N/A","","","Receive","'101870658'","0x9303f0759af717c187dad7f58e69c8ce9bda95ec4664989e1f1d6afe62e34889","1000","0","0","SP2TBW1RSC44JZA4XQ1C2G5SZRGSMM14C5NWAKSDD","","101870658","11/06/2025 17:54:54"
"USD","2025-11-06T17:54:54.000Z","STX","0.001","","0","0","N/A","","","Receive","'101870658'","0x3c1a7faccc4f4e1b39cab163b24ebf09f4000dadf9e5b9fd2f43f33790cc36f0","1000","0","0","SP2TBW1RSC44JZA4XQ1C2G5SZRGSMM14C5NWAKSDD","","101870658","11/06/2025 17:54:54"
"USD","2025-11-06T17:54:54.000Z","","0","STX","1000.000","0.0004","","N/A","N/A","Send","'101870658'","0x814bf6c5c7b8fc2839da14623c2b8662cbb5987849a3758033fb2d76b0498c5c","0","1000000000","400","","SP2TA4FGB43WVAS8MVS6YCWTSN2BZNQ1ASGEAKSDD","101870658","11/06/2025 17:54:54"
"USD","2025-11-05T22:12:46.000Z","STX","564492.460","","0","0","N/A","","","Receive","","0xe7ee146f14fcef40528b89ef1821d0bad9cb6856f467a5fab281190de46a7a68","564492460000","0","0","SPJYNB7A3SGVZMXKHYPJJ9V9WWPN986NRESMN3P9","","","11/05/2025 22:12:46"
"USD","2025-11-04T17:04:04.000Z","STX","17048.032","","0","0.003","N/A","","N/A","Receive","claim-rewards","0xd998c786dc650a3ac26835bf95491e66e98fd0b6db5a7ae630a45f4590bd1387","17048032033","0","3000","SP1DCPBRETA7Z993PVC0DVVZHKCXYTZDC07DHQR3B.lp-incentives-v2","","","11/04/2025 17:04:04"
"USD","2025-11-04T17:04:04.000Z","STX","29743.125","","0","0.003","N/A","","N/A","Receive","claim-rewards","0xec7fcbb768d1c91dada4ef43b791cd67c1aacb411092f166affe1858654f7292","29743125386","0","3000","SP2WFSC5DQ7JQXF0AD2CSKDK5PKF8Z51BMPNMZBVR.lp-incentives-v2","","","11/04/2025 17:04:04"
"USD","2025-11-04T15:14:20.000Z","zaeusdc","999000000000","aeUSDC","999000000000","0.01","N/A","N/A","N/A","Trade Coin","supply","0x376e66a837efdeb42c3102182872147359eb0d0342f09fcb01f284f6afae8519","999000000000","999000000000","10000","","SP2VCQJGH7PHP2DJK7Z0V48AGBHQAW3R3ZW1QF4N.pool-vault","","11/04/2025 15:14:20"
"USD","2025-11-04T15:14:20.000Z","zaeusdc","1669647","","0","0","N/A","","","Receive","supply","0x376e66a837efdeb42c3102182872147359eb0d0342f09fcb01f284f6afae8519","1669647","0","0","","","","11/04/2025 15:14:20"
"USD","2025-11-04T15:14:20.000Z","zaeusdc","1000000000","aeUSDC","1000000000","0.01","N/A","N/A","N/A","Trade Coin","supply","0x7c8a640cd4458b6b50b6b0425c6c3ad4ca7ed410a19064060bdf9ee6bd8746bb","1000000000","1000000000","10000","","SP2VCQJGH7PHP2DJK7Z0V48AGBHQAW3R3ZW1QF4N.pool-vault","","11/04/2025 15:14:20"
"USD","2025-11-04T15:14:20.000Z","zaeusdc","30660621116","","0","0","N/A","","","Receive","supply","0x7c8a640cd4458b6b50b6b0425c6c3ad4ca7ed410a19064060bdf9ee6bd8746bb","30660621116","0","0","","","","11/04/2025 15:14:20"
"USD","2025-11-03T22:52:17.000Z","sbtc-token","388","","0","0","N/A","","","Receive","distribute-rewards","0x0213f6d7606c014ddbf24bca358fc88c1cb72c74d8caf7aa430d413bb5a06087","388","0","0","SP804CDG3KBN9M6E00AD744K8DC697G7HBCG520Q.sbtc-yield-rewards-v3","","","11/03/2025 22:52:17"
"USD","2025-11-02T11:50:17.000Z","sbtc-token","2613","","0","0","N/A","","","Receive","distribute-rewards","0x1b341de2168a31abe6bf25453ecdf9ed34da0757883493f10481ed08eaa6c7f3","2613","0","0","SP804CDG3KBN9M6E00AD744K8DC697G7HBCG520Q.sbtc-yield-rewards-v3","","","11/02/2025 11:50:17"
"USD","2025-10-18T12:24:41.000Z","sbtc-token","2777","","0","0","N/A","","","Receive","distribute-rewards","0x015f46e4e8a81479444f5eb601cc044695991a4a2b2a760fc7b259920ff59fcc","2777","0","0","SP804CDG3KBN9M6E00AD744K8DC697G7HBCG520Q.sbtc-yield-rewards-v3","","","10/18/2025 12:24:41"
"USD","2025-10-03T15:02:27.000Z","sbtc-token","2654","","0","0","N/A","","","Receive","distribute-rewards","0x1a4bf1addc4352f1bdd6327e8f560c9f01b309118e5aade464bcf5171870d7da","2654","0","0","SP804CDG3KBN9M6E00AD744K8DC697G7HBCG520Q.sbtc-yield-rewards-v3","","","10/03/2025 15:02:27"
"USD","2025-09-30T16:58:03.000Z","STX","0.001","","0","0","N/A","","","Receive","'101870658'","0x6aec50b0182d8ed4998185c504f325a4f4711d3531a612ba65ee13f0c18ed417","1000","0","0","SP2TBW1RSC44JZA4XQ1C2G5SZRGSMM14C5NWAKSDD","","101870658","09/30/2025 16:58:03"
"USD","2025-09-30T16:58:03.000Z","STX","0.001","","0","0","N/A","","","Receive","","0x13e3e19c67b59d5dec72eeb60e30aa243198297b9a64b0281c21cd41a05cfbb4","1000","0","0","SP2TJMQFBCKNNFFN632BCP6YRH17D1RBRB42MKSDD","","","09/30/2025 16:58:03"
"USD","2025-09-30T16:58:03.000Z","STX","0.001","","0","0","N/A","","","Receive","'101870658'","0xee753c7148a6dee27624934a2607bed65aaca5c0e7813024ea54147a7329d6a6","1000","0","0","SP2TBW1RSC44JZA4XQ1C2G5SZRGSMM14C5NWAKSDD","","101870658","09/30/2025 16:58:03"
"USD","2025-09-30T16:58:03.000Z","","0","STX","311000.000","0.0004","","N/A","N/A","Send","'101870658'","0x6fa9bf452aca717452863b66a32a560595521ca0d3ddab583c68eab8101cf03d","0","311000000000","400","","SP2TA4FGB43WVAS8MVS6YCWTSN2BZNQ1ASGEAKSDD","101870658","09/30/2025 16:58:03"
"USD","2025-09-30T16:58:03.000Z","STX","0.001","","0","0","N/A","","","Receive","","0x5d9266879032a0325d8765bbc00d5ff9f1bad6f788b4dadaa1a15c2ced759a66","1000","0","0","SP2TJMQFBCKNNFFN632BCP6YRH17D1RBRB42MKSDD","","","09/30/2025 16:58:03"
"USD","2025-09-30T16:58:03.000Z","STX","0.001","","0","0","N/A","","","Receive","'101870658'","0xb8b5c91aaed6ec71b130c847a973307fb6e1cad4d9873a27dd0ce51627c9c622","1000","0","0","SP2TBW1RSC44JZA4XQ1C2G5SZRGSMM14C5NWAKSDD","","101870658","09/30/2025 16:58:03"
"USD","2025-09-30T16:44:04.000Z","","0","STX","1000.000","0.0004","","N/A","N/A","Send","'101870658'","0xc9eb879364a48268ec190ad8d58f4e54e11a313b7b6427f763ae529bc0cbfdf3","0","1000000000","400","","SP2TA4FGB43WVAS8MVS6YCWTSN2BZNQ1ASGEAKSDD","101870658","09/30/2025 16:44:04"
"USD","2025-09-29T01:05:18.000Z","STX","0.001","","0","0","N/A","","","Receive","","0x55459100cf1bf320ab307b8c9cba2eae82000692aae850d666e54ab2d732e993","1000","0","0","SP00E7W7JGS6Q80AC9SKCGPD2X65R4EYGA42000","","","09/29/2025 01:05:18"
"USD","2025-09-29T01:05:18.000Z","STX","312263.660","","0","0","N/A","","","Receive","","0x3c1ec47ce70a0e5a10495237bea10b05590e1bc0e9385501b76f197dffc7501d","312263660000","0","0","SM2Q0SX7FSE8R0FTB8772HSVYSMC0M8MP1S9V9QW4","","","09/29/2025 01:05:18"
"USD","2025-09-20T18:49:15.000Z","sbtc-token","3374","","0","0","N/A","","","Receive","distribute-rewards","0x77f6c68ab42f61397301bed5ddf579bb9ba569d4b2869655a1a15850a99cd11c","3374","0","0","SP804CDG3KBN9M6E00AD744K8DC697G7HBCG520Q.sbtc-yield-rewards-v3","","","09/20/2025 18:49:15"
"USD","2025-09-15T21:45:51.000Z","STX","0.000","","0","0","N/A","","","Receive","send-many","0xa84d07d9de3ac25b2e92f0189d9198f5721e6437d5769fb56884a4b689b056aa","100","0","0","SP3N7TT3EBHAH2976ZBCMGF8H62DJ9AXXW9XE5S80","","","09/15/2025 21:45:51"
"USD","2025-09-08T17:28:52.000Z","STX","0.001","","0","0","N/A","","","Receive","","0xf5c45721aff2e55ef40b54689296610497bf33f3c86a4c953246ec702f5c5c8d","1000","0","0","SP2TJMQFBCKNNFFN632BCP6YRH17D1RBRB42MKSDD","","","09/08/2025 17:28:52"
"USD","2025-09-08T17:28:52.000Z","STX","0.001","","0","0","N/A","","","Receive","'102585532'","0xcc307959c9d6c8ffbe96d9c05a15212fd35bf8dc1437912decbfcf36046a398c","1000","0","0","SP2TBW1RSC44JZA4XQ1C2G5SZRGSMM14C5NWAKSDD","","102585532","09/08/2025 17:28:52"
"USD","2025-09-08T17:28:52.000Z","","0","STX","375280.000","0.0004","","N/A","N/A","Send","'102585532'","0xadf8ded1dee2482ce3e4c76a365b340f3ab32a0097952473957b10b79f24a36a","0","375280000000","400","","SP2TA4FGB43WVAS8MVS6YCWTSN2BZNQ1ASGEAKSDD","102585532","09/08/2025 17:28:52"
"USD","2025-09-08T17:28:52.000Z","STX","0.001","","0","0","N/A","","","Receive","'102585532'","0x733ed7c19b9a639e8fa2cd6b3629c61675da283af11d68b1816933b9f8d0823e","1000","0","0","SP2TBW1RSC44JZA4XQ1C2G5SZRGSMM14C5NWAKSDD","","102585532","09/08/2025 17:28:52"
"USD","2025-09-08T17:28:52.000Z","STX","0.001","","0","0","N/A","","","Receive","","0x952fb54c47fa086c5f0803fa77f16d34d9eac9d5614bbacd0698c475af502c8f","1000","0","0","SP2TJMQFBCKNNFFN632BCP6YRH17D1RBRB42MKSDD","","","09/08/2025 17:28:52"
"USD","2025-09-08T17:24:42.000Z","STX","0.001","","0","0","N/A","","","Receive","'102585532'","0xa3800ce6d256adcfee5b1a1fee24a0684509b11da26cc33f138b04f42ae3dc9d","1000","0","0","SP2TBW1RSC44JZA4XQ1C2G5SZRGSMM14C5NWAKSDD","","102585532","09/08/2025 17:24:42"
"USD","2025-09-08T17:24:42.000Z","","0","STX","1000.000","0.0004","","N/A","N/A","Send","'102585532'","0xf80dd2a6fa9fd3075df46490450ede15494543479333a9c77dda956e99060d66","0","1000000000","400","","SP2TA4FGB43WVAS8MVS6YCWTSN2BZNQ1ASGEAKSDD","102585532","09/08/2025 17:24:42"
"USD","2025-09-07T00:41:53.000Z","sbtc-token","5044","","0","0","N/A","","","Receive","distribute-rewards","0x545ff6a989f24a369c0361119eab9b5620d57312a25d814f33bcf471a73f2d2f","5044","0","0","SP804CDG3KBN9M6E00AD744K8DC697G7HBCG520Q.sbtc-yield-rewards-v3","","","09/07/2025 00:41:53"
"USD","2025-09-05T23:42:23.000Z","STX","0.001","","0","0","N/A","","","Receive","","0xad48356e13d4f32b121d67a608423436a69c5b1d5955c677f653b09ba81eae79","1000","0","0","SPY5Z75KS7XVG1663Q7MJRC4Q3A75JEKM8TQAPFB","","","09/05/2025 23:42:23"
"USD","2025-09-05T23:42:23.000Z","STX","376280.560","","0","0","N/A","","","Receive","","0x3b8c3a9d9e82be3b40fb7e37d0490b1a31986d58a1720eb81a93336b92d1fd46","376280560000","0","0","SPY5GX22C4JX289QK7MA799D0PRGW7BMHFAVAPFB","","","09/05/2025 23:42:23"
"USD","2025-08-28T18:38:03.000Z","STX","0.001","","0","0","N/A","","","Receive","'102585532'","0x627a6df1a04f200a16091d9fb6812bae07ecf91f723a670ddd154b8a4d60ee92","1000","0","0","SP2TBW1RSC44JZA4XQ1C2G5SZRGSMM14C5NWAKSDD","","102585532","08/28/2025 18:38:03"
"USD","2025-08-28T18:38:03.000Z","STX","0.001","","0","0","N/A","","","Receive","","0x0acaab1dc1d065b6f72affa97cbf7fa1ac4d0d5964c7b0e6466ba079c7bd3835","1000","0","0","SP2TJMQFBCKNNFFN632BCP6YRH17D1RBRB42MKSDD","","","08/28/2025 18:38:03"
"USD","2025-08-28T18:38:03.000Z","","0","STX","115933.000","0.0004","","N/A","N/A","Send","'102585532'","0x8873d5575056528fc3568fb8369062c0c109fdbde0a304942becd0e1ef06f156","0","115933000000","400","","SP2TA4FGB43WVAS8MVS6YCWTSN2BZNQ1ASGEAKSDD","102585532","08/28/2025 18:38:03"
"USD","2025-08-28T18:38:03.000Z","STX","0.001","","0","0","N/A","","","Receive","'102585532'","0x56fd5293c92ccf42438a57a21e99eee6795d4d19bf7347c631f0446a1d0c9cbc","1000","0","0","SP2TBW1RSC44JZA4XQ1C2G5SZRGSMM14C5NWAKSDD","","102585532","08/28/2025 18:38:03"
"USD","2025-08-28T18:38:03.000Z","STX","0.001","","0","0","N/A","","","Receive","","0xd17552b6913237ecb32bdb4e71ef2df461c08678193d7dd5842768ea56b4520d","1000","0","0","SP2TJMQFBCKNNFFN632BCP6YRH17D1RBRB42MKSDD","","","08/28/2025 18:38:03"
"USD","2025-08-28T18:38:03.000Z","","0","STX","150.000","0.0004","","N/A","N/A","Send","'102585532'","0xd4694c9ffae5521b5aaecb08f1c6642e4b2c6c62e39a5e68559e8b4fa26f24fb","0","150000000","400","","SP2TA4FGB43WVAS8MVS6YCWTSN2BZNQ1ASGEAKSDD","102585532","08/28/2025 18:38:03"
"USD","2025-08-28T17:54:23.000Z","STX","41067.337","","0","0.003073","N/A","","N/A","Receive","claim-rewards","0x1478b70ec2bdbbce6d4fea2a9afcf63f9c52d05da0cd1c8822eb4acc8ae392e4","41067336981","0","3073","SP32Q8R7BS97CYSTNY1BAGF91QHYJPR2S9FBAV8B2.lp-incentives-v2","","","08/28/2025 17:54:23"
"USD","2025-08-28T17:54:23.000Z","STX","35333.461","","0","0.003","N/A","","N/A","Receive","claim-rewards","0xcc4ef163e111f160f6a4273f299b829bf86901956b7e528e8dd182dbb7b0409d","35333461103","0","3000","SP23SGEVCMWBY7M67BEZMG3HHWXGN43KNHJX973PX.lp-incentives-v2","","","08/28/2025 17:54:23"
"USD","2025-08-28T17:35:55.000Z","lp-token","24161520244","","0","0.003","N/A","","N/A","Receive","claim-rewards","0x03384b4acdb3c463db50eeb305ee93b552c8c540ec7573f5cecd90467225f09d","24161520244","0","3000","SP332XB0Q9ZZHM1K6AJJ12FE61RNCQGF0HVWW2T80.lp-incentives-v2","","","08/28/2025 17:35:55"
"USD","2025-08-28T17:35:55.000Z","lp-token","25464390285","","0","0.003","N/A","","N/A","Receive","claim-rewards","0xb9676e50a79b138070d6b1ee6bf6f75df35c797985a4ef7f735b0c601430ac29","25464390285","0","3000","SP1BXEWB1EKTCPC9G4SYCXY25P8XAHXCV2EV4A38E.lp-incentives-v2","","","08/28/2025 17:35:55"
"USD","2025-08-28T17:35:55.000Z","lp-token","25627540211","","0","0.003","N/A","","N/A","Receive","claim-rewards","0xdb4ef96f1f82f26c902be01616c7a3d6929894a5e1ec7b79d73e5878e277a1f6","25627540211","0","3000","SP3141V7G9K4WYCN2CEV4075S3NV5AFR7JVRJQRGW.lp-incentives-v2","","","08/28/2025 17:35:55"
"USD","2025-08-28T17:35:55.000Z","lp-token","24557628594","","0","0.003","N/A","","N/A","Receive","claim-rewards","0x0e9577fcf459708c19c74656c0f8ba326191bc6ddbfb28c4584336c69043d78e","24557628594","0","3000","SP25C79PQ3HTH73GR63NT7A1JS8D0633HT9KNK2JJ.lp-incentives-v2","","","08/28/2025 17:35:55"
"USD","2025-08-28T17:35:55.000Z","STX","39683.150","","0","0.003","N/A","","N/A","Receive","claim-rewards","0x9d17af9e571d6f32e2e439098ec2c6f7686da3f5c7be1605d982ff2e06849edc","39683150254","0","3000","SP3VTYKR6QSXZ32E961070K998C5V3SNCNK3KH91Z.lp-incentives-v2","","","08/28/2025 17:35:55"
"USD","2025-08-28T17:35:55.000Z","lp-token","23894481644","","0","0.003","N/A","","N/A","Receive","claim-rewards","0x5598147f1ae261f38fe7b4d82ec2abd8b9aa38d9d76208770350185f9dd16919","23894481644","0","3000","SP184ER80H9V3JRA36W8EJKZ63NRMB1YPC1HFW55.lp-incentives-v2","","","08/28/2025 17:35:55"
"USD","2025-08-24T15:28:39.000Z","sbtc-token","5191","","0","0","N/A","","","Receive","distribute-rewards","0x69efd9b0aee173f6fb37b8ddd7963f6ea3840b826b832f6d3bc4f116e966df23","5191","0","0","SP804CDG3KBN9M6E00AD744K8DC697G7HBCG520Q.sbtc-yield-rewards-v3","","","08/24/2025 15:28:39"
"USD","2025-08-18T04:34:39.000Z","Teiko","3000000","","0","0","N/A","","","Receive","","0xbaf23fce9c6319458ada6514399c46623a75525fea82880bd8deaedc7b375101","3000000","0","0","SP1T0VY3DNXRVP6HBM75DFWW0199CR0X15PC1D81B","","","08/18/2025 04:34:39"
"USD","2025-08-17T18:32:39.000Z","STX","0.000","","0","0","N/A","","","Receive","'STX claim live on stxgift.com'","0xb0dc4f8a4e454cf32893f79818895e6dee28ec7702d35d9beced4933af80ff75","1","0","0","SP29RCN66E6SW7BANXYMHD1A9FK3DN0RPM783QTKY","","STX claim live on stxgift.com","08/17/2025 18:32:39"
"USD","2025-08-11T18:17:25.000Z","sbtc-token","5160","","0","0","N/A","","","Receive","distribute-rewards","0x5974542106d14573421656889e774b25c6aa17d57714596149a02b0eaf007342","5160","0","0","SP804CDG3KBN9M6E00AD744K8DC697G7HBCG520Q.sbtc-yield-rewards-v3","","","08/11/2025 18:17:25"
"USD","2025-08-05T17:58:02.000Z","STX","0.001","","0","0","N/A","","","Receive","'101870658'","0x555b75e833e47ed2dd6c4dd056a9298bbab7599186cf7b1333cb16de937748de","1000","0","0","SP2TBW1RSC44JZA4XQ1C2G5SZRGSMM14C5NWAKSDD","","101870658","08/05/2025 17:58:02"
"USD","2025-08-05T17:50:29.000Z","","0","STX","293000.000","0.0004","","N/A","N/A","Send","'101870658'","0x3216422adbd0d19a67d820666db77e267be287c157ee74b05263a322467b529d","0","293000000000","400","","SP2TA4FGB43WVAS8MVS6YCWTSN2BZNQ1ASGEAKSDD","101870658","08/05/2025 17:50:29"
"USD","2025-08-05T17:16:56.000Z","STX","290601.700","","0","0","N/A","","","Receive","","0x06380c39bf4a77a788ac72aff857acbd503978e900d1c4349ce77f25ce778ad1","290601700000","0","0","SP3CJM0SNXPMEC9GJG279NXK4GMJBFWQJZ2KSM55K","","","08/05/2025 17:16:56"
"USD","2025-08-05T17:02:32.000Z","STX","1.000","","0","0","N/A","","","Receive","","0x3e3b8c396af345b7cfe8357d6168da6a8b55eb54a37cbecf7bd524f1cd87fee8","1000000","0","0","SP3CJM0SNXPMEC9GJG279NXK4GMJBFWQJZ2KSM55K","","","08/05/2025 17:02:32"
"USD","2025-07-30T17:10:16.000Z","zaeusdc","2423899560000","aeUSDC","2423899560000","0.003","N/A","N/A","N/A","Trade Coin","supply","0x808839e08f81f0fe42501536fc2456afe28b9feea1ff55c653dd89af1e53034a","2423899560000","2423899560000","3000","","SP2VCQJGH7PHP2DJK7Z0V48AGBHQAW3R3ZW1QF4N.pool-vault","","07/30/2025 17:10:16"
"USD","2025-07-30T17:10:16.000Z","zaeusdc","99055","","0","0","N/A","","","Receive","supply","0x808839e08f81f0fe42501536fc2456afe28b9feea1ff55c653dd89af1e53034a","99055","0","0","","","","07/30/2025 17:10:16"
"USD","2025-07-30T17:06:44.000Z","zaeusdc","1000000000","aeUSDC","1000000000","0.003","N/A","N/A","N/A","Trade Coin","supply","0xd6be284eaa99c850f5bd72b71b50c3ff76ca9ae651feea2fc3c576888c575d79","1000000000","1000000000","3000","","SP2VCQJGH7PHP2DJK7Z0V48AGBHQAW3R3ZW1QF4N.pool-vault","","07/30/2025 17:06:44"
"USD","2025-07-30T17:06:44.000Z","zaeusdc","298732490","","0","0","N/A","","","Receive","supply","0xd6be284eaa99c850f5bd72b71b50c3ff76ca9ae651feea2fc3c576888c575d79","298732490","0","0","","","","07/30/2025 17:06:44"
"USD","2025-07-28T01:12:09.000Z","sbtc-token","5145","","0","0","N/A","","","Receive","distribute-rewards","0x52c75a2198f95c77e001b40e3d327fce512ac57c5cc2ec22d96f8e8460525b2c","5145","0","0","SP804CDG3KBN9M6E00AD744K8DC697G7HBCG520Q.sbtc-yield-rewards-v3","","","07/28/2025 01:12:09"
"USD","2025-07-23T18:48:40.000Z","zaeusdc","2000000000000","aeUSDC","2000000000000","0.003","N/A","N/A","N/A","Trade Coin","supply","0xa4e6a770f9a45287314d91d039ef44539d5133822bb39db628139fa28c3ff67f","2000000000000","2000000000000","3000","","SP2VCQJGH7PHP2DJK7Z0V48AGBHQAW3R3ZW1QF4N.pool-vault","","07/23/2025 18:48:40"
"USD","2025-07-23T18:48:40.000Z","zaeusdc","546793000","","0","0","N/A","","","Receive","supply","0xa4e6a770f9a45287314d91d039ef44539d5133822bb39db628139fa28c3ff67f","546793000","0","0","","","","07/23/2025 18:48:40"
"USD","2025-07-22T15:34:23.000Z","STX","0.001","","0","0","N/A","","","Receive","'101870658'","0x8e68700edac4898e1c78e5af23f0a4bbcf3c179324257c20d0a95d54ad717579","1000","0","0","SP2TBW1RSC44JZA4XQ1C2G5SZRGSMM14C5NWAKSDD","","101870658","07/22/2025 15:34:23"
"USD","2025-07-22T15:34:23.000Z","","0","STX","30000.000","0.0004","","N/A","N/A","Send","'101870658'","0x98d6b40ea70e6353e2a41033a2401f347220d27e8a37887737f1d793f9227492","0","30000000000","400","","SP2TA4FGB43WVAS8MVS6YCWTSN2BZNQ1ASGEAKSDD","101870658","07/22/2025 15:34:23"
"USD","2025-07-21T21:54:41.000Z","STX","0.001","","0","0","N/A","","","Receive","'101870658'","0xb3cf35e05ae8f8393536af898341b014dc3ae561c950060ea77dc5779cc706f2","1000","0","0","SP2TBW1RSC44JZA4XQ1C2G5SZRGSMM14C5NWAKSDD","","101870658","07/21/2025 21:54:41"
"USD","2025-07-21T21:54:41.000Z","","0","STX","299950.000","0.0004","","N/A","N/A","Send","'101870658'","0xcd60e807c5f3c8c2a83335292886c90f300a7fc386f23ae283bf8838359ae0e0","0","299950000000","400","","SP2TA4FGB43WVAS8MVS6YCWTSN2BZNQ1ASGEAKSDD","101870658","07/21/2025 21:54:41"
"USD","2025-07-21T21:54:41.000Z","STX","0.001","","0","0","N/A","","","Receive","'101870658'","0xe4df611ab8398aef42a6737a91f4532665f68738ea00a7aa24e38be53c73dddc","1000","0","0","SP2TBW1RSC44JZA4XQ1C2G5SZRGSMM14C5NWAKSDD","","101870658","07/21/2025 21:54:41"
"USD","2025-07-21T21:54:41.000Z","","0","STX","50.000","0.0004","","N/A","N/A","Send","'101870658'","0xb031168add753e1e87129faf89f90e8278011fcac258e96d5c19624f250efdab","0","50000000","400","","SP2TA4FGB43WVAS8MVS6YCWTSN2BZNQ1ASGEAKSDD","101870658","07/21/2025 21:54:41"
"USD","2025-07-21T20:49:58.000Z","STX","152890.000","","0","0","N/A","","","Receive","","0xe5882610e512b9fc7ef18305e4a83708930f7831ca753ee6ecce2e42422e082e","152890000000","0","0","SP1KE61KVRMKSCZ48WHM5J2DQVXQRK7KESHFAB9AZ","","","07/21/2025 20:49:58"
"USD","2025-07-21T20:49:58.000Z","STX","180406.192","","0","0","N/A","","","Receive","","0xd6399c37b5a3621f6be069e3f02604227fff37fd57590a509fedb7b3726a391b","180406192435","0","0","SP2T0W2S5FBWBJDMHAH64P606AJFGPV9NXN116V6W","","","07/21/2025 20:49:58"
"USD","2025-07-21T20:18:11.000Z","STX","1.000","","0","0","N/A","","","Receive","","0x0a7909a4d6296b95e634205cbe338d50eea98ed875a069f2f71ed6040ad5e737","1000000","0","0","SP2T0W2S5FBWBJDMHAH64P606AJFGPV9NXN116V6W","","","07/21/2025 20:18:11"
"USD","2025-07-13T00:06:46.000Z","sbtc-token","5025","","0","0","N/A","","","Receive","distribute-rewards","0x0cefae0af22db9685f74c7131265aee676f57f0f0148fbb012147e7ea1acd503","5025","0","0","SP804CDG3KBN9M6E00AD744K8DC697G7HBCG520Q.sbtc-yield-rewards-v3","","","07/13/2025 00:06:46"
"USD","2025-07-08T15:14:55.000Z","lp-token","497824044624","aeUSDC","500000000000","0.003","N/A","N/A","N/A","Trade Coin","deposit","0xfbdf565a1e3be0f8a73e75f9a2f1f9b9264dfc5281962416a4fe890206a074b7","497824044624","500000000000","3000","","SP35E2BBMDT2Y1HB0NTK139YBGYV3PAPK3WA8BRNA.state-v1","","07/08/2025 15:14:55"
"USD","2025-07-08T15:14:55.000Z","lp-token","24032225322","","0","0.003","N/A","","N/A","Receive","claim-rewards","0xd81b4c7ba9ab4ac34b0d95b9e3d9a10a0e9ae7df33b85d391b7cae82719b05f2","24032225322","0","3000","SPMCMPRRD1WQHKW5F7PRJW2AZV4K9AEH8SJTQMXF.lp-incentives-v2","","","07/08/2025 15:14:55"
"USD","2025-07-08T15:14:55.000Z","lp-token","26900423271","","0","0.003","N/A","","N/A","Receive","claim-rewards","0x6334ef756384700ae4665fd071aa915cb566c639b8a3c8ca0a4b9aa6d9def9c3","26900423271","0","3000","SP2PRX1PQDFAKTP12TFMEZJNG7BAEF66ZVBD4YP24.lp-incentives-v2","","","07/08/2025 15:14:55"
"USD","2025-07-08T15:14:55.000Z","lp-token","20556289911","","0","0.003","N/A","","N/A","Receive","claim-rewards","0x3f8f33fabf37f8a761d1da0739af95c5210ef6c92f5103d02d256b32ebed056e","20556289911","0","3000","SP2JZQ7BXSEV4H8KXD6ZT0NW293V5ENJR7Y12RPJ3.lp-incentives-v2","","","07/08/2025 15:14:55"
"USD","2025-07-08T15:14:55.000Z","lp-token","14034938244","","0","0.003","N/A","","N/A","Receive","claim-rewards","0x3cfd0501cc8a24f34a0834321d9a9ded52a85a252a3ad9f1634cacbfa143c29b","14034938244","0","3000","SP6XCN5EE7KHWP4V7JP9K9RZYHK1J7S8M7NXWB5K.lp-incentives-v2","","","07/08/2025 15:14:55"
"USD","2025-07-08T15:14:55.000Z","lp-token","2401120282","","0","0.003","N/A","","N/A","Receive","claim-rewards","0x0142c9ecb0f3a257e0034a76b835261fb3f656e06a66b0d7cb54aeb6bede8d48","2401120282","0","3000","SP1D1RBYJ97VA3XYJ2Y19E06CX2AKGB4QX12ETBAC.lp-incentives-v2","","","07/08/2025 15:14:55"
"USD","2025-07-08T15:14:55.000Z","lp-token","61366","","0","0.003","N/A","","N/A","Receive","claim-rewards","0x225e44bf83bd3fcadc5f87834d849910cf974009cd0456007ba4a6b239a81f25","61366","0","3000","SP23MK2Z02H0D6H1SVFHFYGA45AQDW9HK9XZZXNSY.lp-incentives-v2","","","07/08/2025 15:14:55"
"USD","2025-07-08T15:14:55.000Z","zaeusdc","1300000000000","aeUSDC","1300000000000","0.003","N/A","N/A","N/A","Trade Coin","supply","0x0d985d3caa9fa2de5cee7ccd294c8cba3223d1ac90887b3af66d641d94ffa862","1300000000000","1300000000000","3000","","SP2VCQJGH7PHP2DJK7Z0V48AGBHQAW3R3ZW1QF4N.pool-vault","","07/08/2025 15:14:55"
"USD","2025-07-08T15:14:55.000Z","aeUSDC","100000008","STX","0.000","0.00358","N/A","N/A","N/A","Trade Coin","withdraw","0xcc5eb71b727da453b262abfb1a5ce075ec1298092b44b3f84e58f7fca5465751","100000008","2","3580","SP2VCQJGH7PHP2DJK7Z0V48AGBHQAW3R3ZW1QF4N.pool-vault","SP3CRXBDXQ2N5P7E25Q39MEX1HSMRDSEAP3CFK2Z3","","07/08/2025 15:14:55"
"USD","2025-07-08T15:14:55.000Z","zaeusdc","8","zaeusdc","100000008","0","N/A","N/A","","Trade Coin","withdraw","0xcc5eb71b727da453b262abfb1a5ce075ec1298092b44b3f84e58f7fca5465751","8","100000008","0","","","","07/08/2025 15:14:55"
"USD","2025-07-08T15:14:55.000Z","zaeusdc","100000000","aeUSDC","100000000","0.003","N/A","N/A","N/A","Trade Coin","supply","0x54437ee496b875ffbdc263cfaf758a083a3f0fcc75055769574f60cf7dfb41ea","100000000","100000000","3000","","SP2VCQJGH7PHP2DJK7Z0V48AGBHQAW3R3ZW1QF4N.pool-vault","","07/08/2025 15:14:55"
"USD","2025-06-30T18:10:56.000Z","sbtc-token","5997","","0","0","N/A","","","Receive","distribute-rewards","0x1d4d149b688c0b4aea6b27dab89bc8ac28093fa0eec39a4ddce05759c335289f","5997","0","0","SP804CDG3KBN9M6E00AD744K8DC697G7HBCG520Q.sbtc-yield-rewards-v3","","","06/30/2025 18:10:56"
"USD","2025-06-24T17:17:33.000Z","lp-token","995650334120","aeUSDC","1000000000000","0.003","N/A","N/A","N/A","Trade Coin","deposit","0xefa1604ed50dfe1c04f20a3290e731046a19829e771051ad3c5e43be0e394798","995650334120","1000000000000","3000","","SP35E2BBMDT2Y1HB0NTK139YBGYV3PAPK3WA8BRNA.state-v1","","06/24/2025 17:17:33"
"USD","2025-06-18T16:08:28.000Z","lp-token","1393911732824","aeUSDC","1400000000000","0.003","N/A","N/A","N/A","Trade Coin","deposit","0x7711cc205a47eac936309b14456e53068bba6fd699f02165bf81461d9768e2a3","1393911732824","1400000000000","3000","","SP35E2BBMDT2Y1HB0NTK139YBGYV3PAPK3WA8BRNA.state-v1","","06/18/2025 16:08:28"
"USD","2025-06-14T01:10:35.000Z","sbtc-token","4493039","","0","0","N/A","","","Receive","distribute-rewards","0x2a395e179df3bea5a424504ac2e4ad33fbe7ec7625dfe6958e0387c66ba43be7","4493039","0","0","SP804CDG3KBN9M6E00AD744K8DC697G7HBCG520Q.sbtc-yield-rewards-v3","","","06/14/2025 01:10:35"
"USD","2025-06-09T18:39:21.000Z","lp-token","2389566920118","aeUSDC","2400000000000","0.003","N/A","N/A","N/A","Trade Coin","deposit","0x6083865389f7a14eff0b458ed972ad065c0491b335e3f8a8dbfad26b4e8dc853","2389566920118","2400000000000","3000","","SP35E2BBMDT2Y1HB0NTK139YBGYV3PAPK3WA8BRNA.state-v1","","06/09/2025 18:39:21"
"USD","2025-06-03T15:40:53.000Z","","0","sbtc-token","9999007837","0.003","","N/A","N/A","Send","transfer","0xdac1b6fef89b2d9078e487373db16b7244dfeee461ac1bc9f8f55e06a0fcdce1","0","9999007837","3000","","SP3EAB6NKWV1QQ449W9N2CPQEPZVPS13N6VAWKP6T","","06/03/2025 15:40:53"
"USD","2025-06-03T15:40:53.000Z","sbtc-token","10000","","0","0","N/A","","","Receive","transfer","0x5f1b910b499a5212646b34d2e39ca7ae32084907ffb60d2d5e936dfdc3b6fc29","10000","0","0","SP3EAB6NKWV1QQ449W9N2CPQEPZVPS13N6VAWKP6T","","","06/03/2025 15:40:53"
"USD","2025-06-03T15:40:53.000Z","","0","STX","3.000","0.0004","","N/A","N/A","Send","","0xfa22be06f8a77b75ecb87dcf54154e24c249be9da482053b0cccf90207a49cc8","0","3000000","400","","SP3EAB6NKWV1QQ449W9N2CPQEPZVPS13N6VAWKP6T","","06/03/2025 15:40:53"
"USD","2025-06-03T15:40:53.000Z","","0","sbtc-token","10000","0.003","","N/A","N/A","Send","transfer","0x35d216a3710953c6c2207a235c74303d81a4ae293737c44f2629a99414cc77b7","0","10000","3000","","SP3EAB6NKWV1QQ449W9N2CPQEPZVPS13N6VAWKP6T","","06/03/2025 15:40:53"
"USD","2025-06-02T19:38:37.000Z","lp-token","2962082524208","aeUSDC","2975000000000","0.003","N/A","N/A","N/A","Trade Coin","deposit","0x1bae0197704252e59016a07f4dc0a2f4284953d1ccd2fe0d22932e8c7042659f","2962082524208","2975000000000","3000","","SP35E2BBMDT2Y1HB0NTK139YBGYV3PAPK3WA8BRNA.state-v1","","06/02/2025 19:38:37"
"USD","2025-06-02T19:22:06.000Z","lp-token","99565804","aeUSDC","100000000","0.003","N/A","N/A","N/A","Trade Coin","deposit","0xc3d9ec96ba5d5c9d25d0049e9f5eaf20a310bf4308d85f4fdb3776f7cdf29f0d","99565804","100000000","3000","","SP35E2BBMDT2Y1HB0NTK139YBGYV3PAPK3WA8BRNA.state-v1","","06/02/2025 19:22:06"
"USD","2025-05-31T12:03:47.000Z","sbtcdao","80000000000","","0","0","N/A","","","Receive","sbtcdao-rewards","0x89c2d0c5c0cef726755f6a48376fa99b8788bcd3d554d7d808e9005f45d80d05","80000000000","0","0","SP1MR5NKZPJX9CGYPH6YKBHAKK3JM581F1A35JXP6","","","05/31/2025 12:03:47"
"USD","2025-05-22T21:30:06.000Z","aeUSDC","14998999000000","","0","0.003","N/A","","N/A","Receive","unlock","0xffad7c49fcc4dcd0d9692e24b51a5fa9caf288e9de03f1e069bdfbfe72933c26","14998999000000","0","3000","","","","05/22/2025 21:30:06"
"USD","2025-05-22T21:20:55.000Z","aeUSDC","999000000","","0","0.003","N/A","","N/A","Receive","unlock","0x8831171a1f5a5633236cc9fc2d48f51a0bc3701ac65b45615e96ff6d7c72d191","999000000","0","3000","","","","05/22/2025 21:20:55"
"USD","2025-05-22T20:46:39.000Z","","0","aeUSDC","1000000","0.003","","N/A","N/A","Send","transfer","0xa97c0ae3ec558401ba3b8bfd1177dece3a54ce5b691258e768675ca6925a3c62","0","1000000","3000","","SP3DCGG1DY50PR915ZBCNM521P74YTTW7CNHQ0XDG","","05/22/2025 20:46:39"
"USD","2025-05-22T18:12:45.000Z","","0","","0","0.003","","","N/A","XFee Only","enroll","0x1f9bca626109527214a5283ed5d26f0a5579588a03078f80f9156430a3cf7aa6","0","0","3000","","","","05/22/2025 18:12:45"
"USD","2025-05-22T16:49:54.000Z","sbtc-token","9997999439","","0","0","N/A","","","Receive","complete-deposit-wrapper","0x02d7eb6efb74e74a9d14ffc8b05145232ddafdb9533e204c279890be474cd8a9","9997999439","0","0","","","","05/22/2025 16:49:54"
"USD","2025-05-22T16:29:13.000Z","sbtc-token","999438","","0","0","N/A","","","Receive","complete-deposit-wrapper","0xe0b454343dec409bf7c23c39f82cdd47272d6dcb4b69954a5b2db53d0cffcbb1","999438","0","0","","","","05/22/2025 16:29:13"
"USD","2025-05-21T17:03:21.000Z","STX","10.707","STX","0.011","0.003","N/A","N/A","N/A","Trade Coin","swap-helper-b","0xc6ea1a42c6e1e4786883f8a098385e6d6320798f03de86b8f0d2b4cb7fb22946","10707158","10707","3000","SM1793C4R5PZ4NS4VQ4WMP7SKKYVH8JZEWSZ9HCCR.xyk-pool-stx-aeusdc-v-1-2","SP31C60QVZKZ9CMMZX73TQ3F3ZZNS89YX2DCCFT8P","","05/21/2025 17:03:21"
"USD","2025-05-21T17:03:21.000Z","sbtc-token","8960","STX","10.696","0","N/A","N/A","","Trade Coin","swap-helper-b","0xc6ea1a42c6e1e4786883f8a098385e6d6320798f03de86b8f0d2b4cb7fb22946","8960","10696451","0","SM1793C4R5PZ4NS4VQ4WMP7SKKYVH8JZEWSZ9HCCR.xyk-pool-sbtc-stx-v-1-1","SM1793C4R5PZ4NS4VQ4WMP7SKKYVH8JZEWSZ9HCCR.xyk-pool-sbtc-stx-v-1-1","","05/21/2025 17:03:21"
"USD","2025-05-21T17:03:21.000Z","","0","aeUSDC","9990","0","","N/A","","Send","swap-helper-b","0xc6ea1a42c6e1e4786883f8a098385e6d6320798f03de86b8f0d2b4cb7fb22946","0","9990","0","","SP31C60QVZKZ9CMMZX73TQ3F3ZZNS89YX2DCCFT8P","","05/21/2025 17:03:21"
"USD","2025-05-21T17:03:21.000Z","","0","aeUSDC","9980010","0","","N/A","","Send","swap-helper-b","0xc6ea1a42c6e1e4786883f8a098385e6d6320798f03de86b8f0d2b4cb7fb22946","0","9980010","0","","SM1793C4R5PZ4NS4VQ4WMP7SKKYVH8JZEWSZ9HCCR.xyk-pool-stx-aeusdc-v-1-2","","05/21/2025 17:03:21"
"USD","2025-05-21T17:03:21.000Z","","0","aeUSDC","10000","0","","N/A","","Send","swap-helper-b","0xc6ea1a42c6e1e4786883f8a098385e6d6320798f03de86b8f0d2b4cb7fb22946","0","10000","0","","SP3MCM8K9KEJMFM6MN191JVN5CA51MDS7AM3SGYQ6","","05/21/2025 17:03:21"
"USD","2025-05-21T17:03:21.000Z","aeUSDC","5000000","lp-token","4978633","0.003","N/A","N/A","N/A","Trade Coin","withdraw","0x322ae3a51376a2fca3f57fc2af904c6dfb02080bbef5b9e964b2f6312c1cba88","5000000","4978633","3000","SP35E2BBMDT2Y1HB0NTK139YBGYV3PAPK3WA8BRNA.state-v1","","","05/21/2025 17:03:21"
"USD","2025-05-21T17:03:21.000Z","lp-token","9957264","aeUSDC","10000000","0.003","N/A","N/A","N/A","Trade Coin","deposit","0xb51e8e013d5baab15a0b7bbe793151b6be023430fcc7b634fcc04c8a97f16d8c","9957264","10000000","3000","","SP35E2BBMDT2Y1HB0NTK139YBGYV3PAPK3WA8BRNA.state-v1","","05/21/2025 17:03:21"
"USD","2025-05-21T17:03:21.000Z","aeUSDC","5000000","lp-token","4978633","0.003","N/A","N/A","N/A","Trade Coin","withdraw","0x5596abeb0b6540b4fc065563d646939a7dc857c8edc38e34163e0002ddc4527c","5000000","4978633","3000","SP35E2BBMDT2Y1HB0NTK139YBGYV3PAPK3WA8BRNA.state-v1","","","05/21/2025 17:03:21"
"USD","2025-05-21T16:41:08.000Z","lp-token","9957265","aeUSDC","10000000","0.003","N/A","N/A","N/A","Trade Coin","deposit","0x9a8b40879db808f30406ddaae601da38df2b6401bdcc8e55eeb75baee267a3e5","9957265","10000000","3000","","SP35E2BBMDT2Y1HB0NTK139YBGYV3PAPK3WA8BRNA.state-v1","","05/21/2025 16:41:08"
"USD","2025-05-21T14:54:51.000Z","aeUSDC","22564522","","0","0.003","N/A","","N/A","Receive","unlock","0x6dbfbe049aac6bf32fdec74621953f4eaaa898ffcd88e249cb75ac079206ec07","22564522","0","3000","","","","05/21/2025 14:54:51"
"USD","2025-05-20T21:09:57.000Z","STX","6.220","","0","0","N/A","","","Receive","finalize-peg-in-cross-on-index","0x13e6db7202338ec485fbe0c1bfae6ae50ccbfe5e39dadb9705c453fe5498867c","6220108","0","0","SP673Z4BPB4R73359K9HE55F2X91V5BJTN5SXZ5T.meta-peg-in-endpoint-v2-04","","","05/20/2025 21:09:57"
"USD","2025-05-20T17:57:52.000Z","sbtc-token","9130","","0","0","N/A","","","Receive","complete-deposit-wrapper","0xaadc3064151731b212f08625183535a55abadd6667d4b477f71c36cd726910d9","9130","0","0","","","","05/20/2025 17:57:52"